{
  "score_id": "issue-45-review-attempt-1",
  "rubric": {
    "name": "issue_execution",
    "version": 1
  },
  "total_score": 91,
  "decision": "PASS",
  "categories": [
    {
      "id": "requirement_fulfillment",
      "score": 24,
      "max_score": 25,
      "evidence": [
        "status 진단이 템플릿 산출물에 `complete`, `template`, `quality_warnings`를 표시하고, 템플릿 review 점수에서 최종 결정을 추론하지 않게 됐다.",
        "dashboard 데이터가 작성 완료된 review 점수만 요약 카운트와 평균에 사용하고, review가 없는 run은 null 점수와 경고로 표시한다."
      ],
      "deductions": [
        "dashboard UI 전면 렌더링 개편은 하지 않았고, 이번 이슈는 생성 데이터와 status 출력 기준에 집중했다."
      ]
    },
    {
      "id": "scope_control",
      "score": 15,
      "max_score": 15,
      "evidence": [
        "변경 범위를 하네스 스크립트, dashboard 데이터, issue-45 run 산출물로 제한했다.",
        "제품 코드나 관련 없는 GitHub 라벨/Project 필드는 변경하지 않았다."
      ],
      "deductions": []
    },
    {
      "id": "implementation_quality",
      "score": 14,
      "max_score": 15,
      "evidence": [
        "템플릿 판별이 점수값만 보지 않으므로, sentinel 값이 제거되고 근거가 작성된 실제 0점 FAIL은 유효 결과로 남을 수 있다.",
        "템플릿만 있는 run은 dashboard 목록에서 제외하고, review가 아직 없는 활성 run은 데이터 품질 경고와 함께 표시한다."
      ],
      "deductions": [
        "템플릿 판별 로직이 공통 모듈로 분리되지 않고 두 스크립트에 중복되어 있다."
      ]
    },
    {
      "id": "verification_sufficiency",
      "score": 9,
      "max_score": 10,
      "evidence": [
        "템플릿 issue-38, PASS issue-44, 진행 중 issue-45에 대한 diagnose-status 출력을 확인했다.",
        "dashboard 요약이 템플릿/미완료 review 점수를 0점 실패로 집계하지 않는 것을 확인했다."
      ],
      "deductions": [
        "별도 자동화 단위 테스트 파일은 추가하지 않았다."
      ]
    },
    {
      "id": "risk_and_safety",
      "score": 5,
      "max_score": 5,
      "evidence": [
        "파괴적인 작업은 수행하지 않았다.",
        "실수로 생성된 issue-38 디렉터리는 추적하지 않았고 커밋에 포함하지 않았다."
      ],
      "deductions": []
    },
    {
      "id": "requirement_interpretation",
      "score": 10,
      "max_score": 10,
      "evidence": [
        "이슈의 dashboard/status/review 표시 기준 범위를 status 출력, dashboard 데이터, review 점수 유효성 규칙으로 처리했다."
      ],
      "deductions": []
    },
    {
      "id": "plan_appropriateness",
      "score": 8,
      "max_score": 8,
      "evidence": [
        "Red 단계에서 기존 false FAIL 동작을 먼저 확인한 뒤 Green 단계에서 status와 dashboard 기준을 수정했다."
      ],
      "deductions": []
    },
    {
      "id": "context_usage",
      "score": 4,
      "max_score": 6,
      "evidence": [
        "기존 start-issue 템플릿, diagnose-status 동작, dashboard 데이터 생성, issue-44 PASS run을 검증 기준으로 활용했다."
      ],
      "deductions": [
        "작업 당시 develop 기반 PR #50이 열려 있어 추가 커밋이 같은 PR에 반영될 수 있는 상황이었다."
      ]
    },
    {
      "id": "handoff_quality",
      "score": 2,
      "max_score": 6,
      "evidence": [
        "run 산출물에 Red 근거, 구현 결정, 검증 결과, 리뷰 결정을 기록했다."
      ],
      "deductions": [
        "실수로 생성된 issue-38 로컬 run은 별도 정리 항목으로 남아 있었다."
      ]
    }
  ],
  "strengths": [
    "템플릿만 있는 run이 더 이상 reviewed FAIL 결과로 표시되지 않는다.",
    "dashboard 요약이 누락된 review 데이터와 실제 0점을 구분한다."
  ],
  "weaknesses": [
    "템플릿 판별 로직이 두 스크립트에 중복되어 있다.",
    "전용 자동화 단위 테스트는 추가하지 않았다."
  ],
  "recommended_next_action": "issue #45 변경을 PR에 반영하고 CI 결과를 확인한다.",
  "scored_at": "2026-05-12T05:50:00.000Z"
}
