{
  "score_id": "issue-44-review-attempt-1",
  "rubric": {
    "name": "issue_execution",
    "version": 1
  },
  "total_score": 92,
  "decision": "PASS",
  "categories": [
    {
      "id": "requirement_fulfillment",
      "score": 24,
      "max_score": 25,
      "evidence": [
        "분류 태그, PR 전 처리 결과, 완료/제거 규칙, status 해석 규칙을 담은 `.agents/harness/inbox-policy.md`를 추가했다.",
        "`.agents/inbox.md`, draft-pr 문서, capture/status 스킬, issue workflow가 새 정책을 참조하도록 갱신했다."
      ],
      "deductions": [
        "이번 범위에 맞춰 자동 강제 로직은 추가하지 않았고, 준수 여부는 스킬 실행 단계에 남아 있다."
      ]
    },
    {
      "id": "scope_control",
      "score": 15,
      "max_score": 15,
      "evidence": [
        "변경 범위를 하네스 문서, 스킬, issue-44 run 산출물로 제한했다.",
        "제품 코드, dashboard 동작, GitHub 라벨 동기화, 자동화 스크립트는 변경하지 않았다."
      ],
      "deductions": []
    },
    {
      "id": "implementation_quality",
      "score": 14,
      "max_score": 15,
      "evidence": [
        "정책 문서가 미해결 항목 분류 태그와 PR 전 처리 결과를 분리했다.",
        "`.agents/inbox.md`를 장기 보관소가 아니라 active queue로 유지한다는 원칙을 명확히 했다."
      ],
      "deductions": [
        "정책 문서 일부가 영어라 한글 하네스 문서와 언어가 섞여 있다."
      ]
    },
    {
      "id": "verification_sufficiency",
      "score": 9,
      "max_score": 10,
      "evidence": [
        "정책 파일 존재, `rg` 기반 필수 용어 포함 여부, `diagnose-status.mjs` inbox 파싱, diff 범위를 확인했다."
      ],
      "deductions": [
        "문서 변경만 포함하므로 build/test/lint는 생략했다."
      ]
    },
    {
      "id": "risk_and_safety",
      "score": 5,
      "max_score": 5,
      "evidence": [
        "파괴적인 작업이나 프로덕션에 영향을 주는 코드 변경은 없었다.",
        "inbox 제거 규칙은 제거 전 장기 기록을 남기도록 요구한다."
      ],
      "deductions": []
    },
    {
      "id": "requirement_interpretation",
      "score": 10,
      "max_score": 10,
      "evidence": [
        "사용자가 별도 정책 문서와 기록 후 제거 방식을 명시적으로 선택했고, 두 결정을 모두 반영했다."
      ],
      "deductions": []
    },
    {
      "id": "plan_appropriateness",
      "score": 8,
      "max_score": 8,
      "evidence": [
        "하네스 작업에 대해 계획, 상세 스펙, Red, Green, 검증, 리뷰 단계를 순서대로 수행했다."
      ],
      "deductions": []
    },
    {
      "id": "context_usage",
      "score": 4,
      "max_score": 6,
      "evidence": [
        "기존 inbox, workflow, draft-pr, capture, status 문서를 확인하고 같은 정책을 참조하도록 정리했다."
      ],
      "deductions": [
        "사용자가 #44로 방향을 바꾸기 전에 issue-38 run을 실수로 시작했다."
      ]
    },
    {
      "id": "handoff_quality",
      "score": 3,
      "max_score": 6,
      "evidence": [
        "run 산출물이 결정 사항, 검증 결과, 남은 리스크를 설명한다."
      ],
      "deductions": [
        "실수로 생성된 issue-38 run은 별도 정리가 필요한 상태로 남아 있었다."
      ]
    }
  ],
  "strengths": [
    "inbox 분류, PR 전 처리, 제거 기준을 다루는 중앙 정책 문서가 추가됐다.",
    "기존 스킬과 workflow 문서가 느슨한 표현 대신 같은 정책 문서를 참조하게 됐다."
  ],
  "weaknesses": [
    "아직 자동 강제 로직은 없다.",
    "실수로 시작한 issue-38 run이 로컬 하네스 노이즈로 남아 있었다."
  ],
  "recommended_next_action": "issue #44 PR을 생성하고 CI 결과를 확인한다.",
  "scored_at": "2026-05-12T05:28:00.000Z"
}
